{
  "episode_id": "MATH-G10-U01-L03",
  "status": "ok",
  "meta": {
    "subject": "الرياضيات",
    "grade": "أول ثانوي",
    "semester": "1",
    "unit": "01",
    "lesson": "03",
    "official_title": "العبارات الشرطية"
  },
  "objectives": [
    {
      "text": "تحليل العبارة الشرطية إلى فرض ونتيجة",
      "source": "inferred",
      "page": null
    },
    {
      "text": "كتابة العكس والمعكوس والمعاكس الإيجابي لعبارة شرطية وتحديد قيم صوابها",
      "source": "inferred",
      "page": null
    }
  ],
  "terms": [
    {
      "term": "العبارة الشرطية",
      "definition": "عبارة بالصيغة: إذا p فإن q",
      "source": "inferred",
      "page": null
    },
    {
      "term": "الفرض",
      "definition": "الجزء الذي يلي «إذا»",
      "source": "inferred",
      "page": null
    },
    {
      "term": "النتيجة",
      "definition": "الجزء الذي يلي «فإن»",
      "source": "inferred",
      "page": null
    },
    {
      "term": "العكس",
      "definition": "تبديل الفرض والنتيجة: إذا q فإن p",
      "source": "inferred",
      "page": null
    },
    {
      "term": "المعكوس",
      "definition": "نفي الفرض والنتيجة: إذا ~p فإن ~q",
      "source": "inferred",
      "page": null
    },
    {
      "term": "المعاكس الإيجابي",
      "definition": "نفي العكس: إذا ~q فإن ~p",
      "source": "inferred",
      "page": null
    },
    {
      "term": "المثال المضاد",
      "definition": "مثال يتحقق فيه الفرض ولا تتحقق النتيجة، فيثبت أن العبارة خاطئة",
      "source": "inferred",
      "page": null
    }
  ],
  "rules": [
    {
      "text": "العبارة الشرطية والمعاكس الإيجابي لها متكافئتان منطقيًا (لهما نفس قيمة الصواب)",
      "source": "inferred",
      "page": null
    },
    {
      "text": "العكس لا يلزم أن يكون صحيحًا عندما تكون العبارة الأصلية صحيحة",
      "source": "inferred",
      "page": null
    }
  ],
  "misconceptions": [
    {
      "text": "الظن بأن العكس صحيح دائمًا إذا كانت العبارة صحيحة",
      "source": "inferred",
      "page": null
    },
    {
      "text": "الظن بأن «أكثر من 50» تشمل 50",
      "source": "inferred",
      "page": null
    }
  ],
  "difficulty_point": "التمييز بين العكس والمعكوس والمعاكس الإيجابي ومعرفة أيها يحافظ على قيمة الصواب",
  "core_concept": "العبارة الشرطية (إذا… فإن…) وصيغها المرتبطة الثلاث وقيمة صوابها",
  "learning_gap": {
    "before": "يظن الطالب أن قلب الجملة الشرطية أو نفيها لا يغيّر صحتها، ولا يعرف لماذا لم يحصل على الخصم",
    "after": "يحدد الفرض والنتيجة ويكتب العكس والمعكوس والمعاكس الإيجابي، ويعرف أن المعاكس الإيجابي فقط يحمل نفس قيمة صواب الأصلية"
  }
}